{
  "schema_version": 1,
  "adapter": "workflow_engine",
  "case_id": "status_success",
  "direction": "outbound",
  "evidence_scope": "recorded_contract_only",
  "network_policy": "no_live_call",
  "tenant_scope": {
    "tenant_fixture": "../tenants.json",
    "resolution_stage": "tenant_known",
    "tenant_id": "11111111-1111-4111-8111-111111111111"
  },
  "request": {
    "method": "GET",
    "route_template": "/api/executions/{execution_id}",
    "header_names": [
      "Content-Type",
      "Authorization"
    ],
    "redacted_headers": [
      {
        "name": "Authorization",
        "value": "[REDACTED_FIXTURE]"
      }
    ],
    "body": {
      "fixture_event_ref": "status_success"
    }
  },
  "transport": {
    "outcome": "response",
    "attempt": 1,
    "elapsed_ms_bucket": "under_5000"
  },
  "response": {
    "status": 200,
    "header_names": [
      "Content-Type"
    ],
    "redacted_headers": [],
    "body": {
      "execution_ref": "EXECUTION-RECORDED-1",
      "status": "completed",
      "decision": "approved"
    }
  },
  "expected": {
    "adapter_status": "completed",
    "outbox_status": "delivered",
    "retry_scheduled": false,
    "duplicate_of": null,
    "canonical_state_mutated": false,
    "audit_code": "RECORDED_CONTRACT_OK",
    "response_status": 200
  }
}
