{
  "schema_version": 1,
  "adapter": "webhook_engine",
  "case_id": "unknown_source",
  "direction": "inbound",
  "evidence_scope": "recorded_contract_only",
  "network_policy": "no_live_call",
  "tenant_scope": {
    "tenant_fixture": "../tenants.json",
    "resolution_stage": "pre_tenant_unknown_source",
    "tenant_id": null
  },
  "request": {
    "method": "POST",
    "route_template": "/api/integrations/webhook-engine/bid-updates",
    "header_names": [
      "Content-Type",
      "Authorization"
    ],
    "redacted_headers": [
      {
        "name": "Authorization",
        "value": "[REDACTED_FIXTURE]"
      }
    ],
    "body": {
      "source_ref": "SOURCE-RECORDED-UNKNOWN",
      "event_ref": "EVENT-RECORDED-2"
    }
  },
  "transport": {
    "outcome": "response",
    "attempt": 1,
    "elapsed_ms_bucket": "under_5000"
  },
  "response": {
    "status": 200,
    "header_names": [
      "Content-Type"
    ],
    "redacted_headers": [],
    "body": {
      "status": "acknowledged"
    }
  },
  "expected": {
    "adapter_status": "ignored",
    "outbox_status": "not_applicable",
    "retry_scheduled": false,
    "duplicate_of": null,
    "canonical_state_mutated": false,
    "audit_code": "WEBHOOK_UNKNOWN_SOURCE",
    "response_status": 200
  }
}
