{
  "schema_version": 1,
  "adapter": "notification_hub",
  "case_id": "timeout",
  "direction": "outbound",
  "evidence_scope": "recorded_contract_only",
  "network_policy": "no_live_call",
  "tenant_scope": {
    "tenant_fixture": "../tenants.json",
    "resolution_stage": "tenant_known",
    "tenant_id": "11111111-1111-4111-8111-111111111111"
  },
  "request": {
    "method": "POST",
    "route_template": "/api/events",
    "header_names": [
      "Content-Type",
      "Authorization"
    ],
    "redacted_headers": [
      {
        "name": "Authorization",
        "value": "[REDACTED_FIXTURE]"
      }
    ],
    "body": {
      "event_type": "clearing_infeasible",
      "auction_ref": "AUC-RECORDED-2",
      "relaxation_count": 2
    }
  },
  "transport": {
    "outcome": "timeout",
    "attempt": 1,
    "elapsed_ms_bucket": "under_5000"
  },
  "response": null,
  "expected": {
    "adapter_status": "timeout",
    "outbox_status": "retry_scheduled",
    "retry_scheduled": true,
    "duplicate_of": null,
    "canonical_state_mutated": false,
    "audit_code": "RECORDED_CONTRACT_OK",
    "response_status": null
  }
}
