{
  "schema_version": 1,
  "adapter": "workflow_engine",
  "case_id": "rate_limited_429",
  "direction": "outbound",
  "evidence_scope": "recorded_contract_only",
  "network_policy": "no_live_call",
  "tenant_scope": {
    "tenant_fixture": "../tenants.json",
    "resolution_stage": "tenant_known",
    "tenant_id": "11111111-1111-4111-8111-111111111111"
  },
  "request": {
    "method": "POST",
    "route_template": "/api/workflows/{workflow_id}/execute",
    "header_names": [
      "Content-Type",
      "Authorization"
    ],
    "redacted_headers": [
      {
        "name": "Authorization",
        "value": "[REDACTED_FIXTURE]"
      }
    ],
    "body": {
      "fixture_event_ref": "rate_limited_429"
    }
  },
  "transport": {
    "outcome": "response",
    "attempt": 1,
    "elapsed_ms_bucket": "under_5000"
  },
  "response": {
    "status": 429,
    "header_names": [
      "Content-Type"
    ],
    "redacted_headers": [],
    "body": {
      "code": "RATE_LIMITED",
      "retry_after_seconds": 5
    }
  },
  "expected": {
    "adapter_status": "rate_limited",
    "outbox_status": "retry_scheduled",
    "retry_scheduled": true,
    "duplicate_of": null,
    "canonical_state_mutated": false,
    "audit_code": "RECORDED_CONTRACT_OK",
    "response_status": 429
  }
}
